id,title,creator,year,format,category,subcategory,difficulty,credibility,usefulness,status,source_link,tags
cs106e-ai-machine-learning-notes,AI & Machine Learning (Stanford CS106E Lecture Notes),Stanford CS106E,,Lecture Notes (PDF),AI Foundations,Intro explainers,Beginner,8,6,reviewed,https://web.stanford.edu/class/cs106e/lectureNotes/L23NAIMachineLearning.pdf,ai; machine-learning; intro; stanford; lecture-notes
cmu-15780-intro-ai,Introduction to Graduate Artificial Intelligence (CMU 15-780),Carnegie Mellon University 15-780,,Lecture Slides (PDF),AI Foundations,Course material,Advanced,8,6,reviewed,https://www.cs.cmu.edu/~15780/15-780_files/lecture_slides/Lecture1_intro.pdf,ai; cmu; graduate-course; foundations
allan-dafoe-ai-talks,Allan Dafoe — AI Governance & Safety Talks,Allan Dafoe,,Talk Collection,AI in Practice,AI safety & governance,Intermediate,8,6,reviewed,https://www.allandafoe.com/ai-talks,ai-safety; ai-governance; policy; deepmind
ui-talks-product-management,UI Talks — Product Management (Curated Collection),UI Patterns (UI Talks),,Talk Collection,Product and Design,Product management,Intermediate,7,7,reviewed,https://talks.ui-patterns.com/topics/product-management,product-management; talks; curated; strategy
the-intelligence-age,The Intelligence Age,Sam Altman,2024,Essay,AI in Practice,AI vision,Beginner,7,7,reviewed,https://ia.samaltman.com/,ai; abundance; platform-shift; openai
super-founders,Super Founders,Ali Tamaseb,2021,Book,Startup History,Founder data,Intermediate,7,7,reviewed,,founders; data; unicorns; myths
hooked-how-to-build-habit-forming-products,Hooked: How to Build Habit-Forming Products,Nir Eyal,2014,Book,Product and Design,Behavioral design,Beginner,7,7,reviewed,,habits; engagement; behavioral-design; ethics
the-tyranny-of-the-marginal-user,The Tyranny of the Marginal User,Ivan Vendrov,2022,Essay,Product and Design,Product decay,Intermediate,7,7,recommended,https://nothinghuman.substack.com/p/the-tyranny-of-the-marginal-user,product; metrics; enshittification; ux
valley-of-genius,Valley of Genius,Adam Fisher,2018,Book,Internet and Big Tech History,Oral history,Beginner,7,7,reviewed,,oral-history; silicon-valley; lore; history
the-social-network,The Social Network,David Fincher (dir.) / Aaron Sorkin,2010,Film,Documentary and Long-Form Media,Founder mythology,Beginner,7,7,recommended,,facebook; film; founders; culture
meditations-on-moloch,Meditations on Moloch,Scott Alexander,2014,Essay,Founder Mental Models,Coordination & game theory,Advanced,7,7,reviewed,https://slatestarcodex.com/2014/07/30/meditations-on-moloch/,coordination; game-theory; incentives; rationalism
web3-is-going-just-great,Web3 Is Going Just Great,Molly White,2021,Website / running ledger,Crypto and Web3,Critique,Beginner,7,7,reviewed,https://www.web3isgoinggreat.com/,crypto; critique; scams; skepticism
where-is-my-flying-car,Where Is My Flying Car?,J. Storrs Hall,2018,Book,"Climate, Energy, and Deep Tech",Stagnation & progress,Intermediate,7,7,reviewed,,deep-tech; energy; stagnation; progress
how-to-avoid-a-climate-disaster,How to Avoid a Climate Disaster,Bill Gates,2021,Book,"Climate, Energy, and Deep Tech",Climate strategy,Beginner,7,7,reviewed,,climate; net-zero; green-premium; deep-tech
blitzscaling,Blitzscaling,Reid Hoffman & Chris Yeh,2018,Book,Global Tech and Non-US Ecosystems,Scaling & global competition,Intermediate,7,7,reviewed,,scaling; winner-take-most; china; strategy
remote-office-not-required,Remote: Office Not Required,Jason Fried & David Heinemeier Hansson,2013,Book,Future of Work and Labor,Remote work,Beginner,7,7,reviewed,,remote-work; async; culture; management
a-world-without-email,A World Without Email,Cal Newport,2021,Book,Future of Work and Labor,Knowledge work,Beginner,7,7,reviewed,,productivity; email; focus; knowledge-work
the-pentagon-s-brain,The Pentagon's Brain,Annie Jacobsen,2015,Book,"Defense, Gov, and Public Tech",DARPA history,Intermediate,8,6,reviewed,,darpa; defense; history; r-and-d
ai-2027,AI 2027,"AI Futures Project (Kokotajlo, Lifland, Larsen, Dean)",2025,Scenario forecast,AI in Practice,AGI forecasting,Intermediate,7,7,recommended,https://ai-2027.com/,agi; forecast; race-dynamics; scenario
nexus-a-brief-history-of-information-networks,Nexus: A Brief History of Information Networks,Yuval Noah Harari,2024,Book,Internet and Big Tech History,Information & power,Beginner,7,7,reviewed,,information; history; ai; society
something-ventured-documentary,Something Ventured,"Dan Geller, Dayna Goldfine",2011,Documentary,Documentary and Long-Form Media,Venture History,Beginner,7,6,reviewed,,documentary; venture-capital; silicon-valley; history
triumph-of-the-nerds,Triumph of the Nerds,Robert X. Cringely,1996,Documentary,Documentary and Long-Form Media,PC History,Beginner,7,6,reviewed,https://www.pbs.org/nerds/,documentary; personal-computing; apple; microsoft; history
edx-columbia-ai-study-guide,Artificial Intelligence (AI) by edX — Columbia University (Study Guide),"Josh Wentz (notes on Columbia CSMM.101x, Ansaf Salleb-Aouissi)",,Study Guide (Article),AI Foundations,Course notes,Intermediate,7,6,reviewed,https://medium.com/@joshwentz/artificial-intelligence-ai-by-edx-2ae1067103c8,ai; course-notes; edx; columbia; self-study
pirates-of-silicon-valley,Pirates of Silicon Valley,Martyn Burke (dir.),1999,Film,Documentary and Long-Form Media,Founder mythology,Beginner,7,6,reviewed,,apple; microsoft; jobs; gates
the-californian-ideology,The Californian Ideology,Richard Barbrook & Andy Cameron,1995,Essay,Internet and Big Tech History,Tech culture critique,Advanced,7,6,reviewed,,tech-politics; ideology; critique; culture
snow-crash,Snow Crash,Neal Stephenson,1992,Book,Internet and Big Tech History,Sci-fi & tech imagination,Intermediate,7,6,reviewed,,metaverse; sci-fi; cyberpunk; vr
going-infinite-the-rise-and-fall-of-a-new-tycoon,Going Infinite: The Rise and Fall of a New Tycoon,Michael Lewis,2023,Book,Crypto and Web3,Fraud & collapse,Beginner,7,6,reviewed,,ftx; sbf; fraud; effective-altruism
number-go-up,Number Go Up,Zeke Faux,2023,Book,Crypto and Web3,Critique,Beginner,7,6,reviewed,,crypto; tether; bubble; critique
read-write-own,Read Write Own,Chris Dixon,2024,Book,Crypto and Web3,Web3 thesis,Beginner,7,6,reviewed,,web3; tokens; ownership; a16z
speed-scale,Speed & Scale,John Doerr,2021,Book,"Climate, Energy, and Deep Tech",Climate execution,Beginner,7,6,reviewed,,climate; okrs; execution; venture
the-billionaire-raj,The Billionaire Raj,James Crabtree,2018,Book,Global Tech and Non-US Ecosystems,India,Intermediate,7,6,reviewed,,india; markets; inequality; ecosystems
bullshit-jobs,Bullshit Jobs,David Graeber,2018,Book,Future of Work and Labor,Meaning of work,Beginner,7,6,reviewed,,work; meaning; automation; labor
rise-of-the-robots,Rise of the Robots,Martin Ford,2015,Book,Future of Work and Labor,Automation,Beginner,7,6,reviewed,,automation; jobs; ubi; labor
996-icu,996.ICU,Chinese tech workers (GitHub),2019,Open repository / movement,Future of Work and Labor,Labor & culture,Beginner,7,6,reviewed,https://github.com/996icu/996.ICU,996; overwork; china; labor
the-ai-doc-or-how-i-became-an-apocaloptimist,The AI Doc: Or How I Became an Apocaloptimist,Daniel Roher & Charlie Tyrell (dir.),2026,Documentary,Documentary and Long-Form Media,AI & society,Beginner,7,6,reviewed,,documentary; ai; sundance; 2026
ghost-in-the-machine,Ghost in the Machine,Valerie Veatch (dir.),2026,Documentary,Documentary and Long-Form Media,AI critique & history,Intermediate,7,6,reviewed,,documentary; ai-history; critique; ethics
canon-of-design-product-management,The Canon of Design for a New Journey in Product Management,Rajiv Kaul (Intelligaia),,Slides,Product and Design,Design-led product,Beginner,6,6,reviewed,https://pt.slideshare.net/slideshow/canon-of-design-for-a-new-journey-in-product-management/66867250,product-management; design; design-systems; slides
agi-ruin-a-list-of-lethalities,AGI Ruin: A List of Lethalities,Eliezer Yudkowsky,2022,Essay,AI in Practice,AI risk,Advanced,6,6,reviewed,https://www.lesswrong.com/posts/uMQ3CqWDPHhjtiesc/agi-ruin-a-list-of-lethalities,ai-safety; alignment; x-risk; rationalism
chaos-monkeys,Chaos Monkeys,Antonio García Martínez,2016,Book,Internet and Big Tech History,Insider memoir,Beginner,6,6,reviewed,,memoir; facebook; ad-tech; yc
the-social-dilemma,The Social Dilemma,Jeff Orlowski (dir.),2020,Documentary,Documentary and Long-Form Media,Tech & society,Beginner,6,6,reviewed,,social-media; attention; ethics; documentary
rebuild-the-arsenal-of-democracy-anduril,Rebuild the Arsenal of Democracy (Anduril),Palmer Luckey / Anduril,2024,Manifesto / essay,"Defense, Gov, and Public Tech",Defense startups,Beginner,6,6,reviewed,,anduril; defense-tech; manifesto; industrial-base
if-anyone-builds-it-everyone-dies,"If Anyone Builds It, Everyone Dies",Eliezer Yudkowsky & Nate Soares,2025,Book,AI in Practice,AI risk,Beginner,6,6,reviewed,https://ifanyonebuildsit.com/,ai-safety; x-risk; alignment; doom
