id,title,creator,year,format,category,subcategory,difficulty,credibility,usefulness,status,source_link,tags
makers-schedule-managers-schedule,"Maker's Schedule, Manager's Schedule",Paul Graham,2009,Essay,Founder Mental Models,Productivity & Focus,Beginner,9,8,recommended,https://paulgraham.com/makersschedule.html,productivity; focus; deep-work; essay
inspired-cagan,Inspired: How to Create Tech Products Customers Love,Marty Cagan,2017,Book,Product and Design,Product Management,Intermediate,8,9,recommended,https://www.wiley.com/en-us/INSPIRED%3A+How+to+Create+Tech+Products+Customers+Love%2C+2nd+Edition-p-9781119387503,product-management; product-discovery; teams; tech-products
secrets-of-sand-hill-road,Secrets of Sand Hill Road,Scott Kupor,2019,Book,Venture Capital and Fundraising,How VC Works,Intermediate,8,9,recommended,,venture-capital; fundraising; term-sheets; fund-economics
venture-deals,Venture Deals,"Brad Feld, Jason Mendelson",2011,Book,Venture Capital and Fundraising,Term Sheets & Mechanics,Intermediate,8,9,recommended,,venture-capital; term-sheets; negotiation; fundraising
as-we-may-think,As We May Think,Vannevar Bush,1945,Essay,Internet and Big Tech History,Foundational Vision,Intermediate,10,7,recommended,https://www.theatlantic.com/magazine/archive/1945/07/as-we-may-think/303881/,internet-history; memex; hypertext; foundational-essay
the-computer-chronicles-the-internet-1993,The Computer Chronicles - The Internet (1993),The Computer Chronicles,1993,TV episode,Documentary and Long-Form Media,Web history,Beginner,9,8,recommended,https://www.youtube.com/watch?v=U_o8gerare0,internet history; early web; Computer Chronicles; archival video
the-machine-that-changed-the-world-episode-1-great-brains,The Machine That Changed the World - Episode 1: Great Brains,WGBH / BBC,1992,Documentary episode,Documentary and Long-Form Media,Computer history documentary,Beginner,9,8,recommended,https://www.youtube.com/watch?v=gOx3TKl-ScU,computer history; documentary; pioneers; hardware
the-machine-that-changed-the-world-episode-2-inventing-the-f,The Machine That Changed the World - Episode 2: Inventing the Future,WGBH / BBC,1992,Documentary episode,Documentary and Long-Form Media,Historical computing demo,Beginner,9,8,recommended,https://www.youtube.com/watch?v=8KnkeON3UEE,computer history; documentary; software; personal computing
inside-apple-software-design,Inside Apple Software Design,a16z / Ken Kocienda,2019,Podcast interview,Product and Design,Interview / software history,Intermediate,9,8,recommended,https://a16z.com/podcast/inside-apple-software-design/,apple; software design; interview; podcast
design-thinking-human-centered-innovation,Design Thinking: Human-Centered Innovation,IDEO,,Article / resource hub,Product and Design,Human-centered design,Beginner,9,8,recommended,https://designthinking.ideo.com/,design thinking; ideo; human-centered; framework
andrew-ng-building-faster-with-ai,Building Faster with AI,Andrew Ng,,Talk,AI in Practice,Building with AI,Intermediate,9,8,recommended,https://www.youtube.com/watch?v=RNJCfif1dPY,applied-ai; agents; productivity; andrew-ng; building
a-survey-of-venture-capital-research,A survey of venture capital research,"Marco Da Rin, Thomas Hellmann, Manju Puri / NBER",2011,Survey article,Venture Capital and Fundraising,Core Historical Foundations,Advanced,9,8,recommended,https://www.nber.org/system/files/working_papers/w17523/w17523.pdf,survey; research; venture capital; NBER
roundtable-summary-towards-a-better-aligned-private-equity-w,Roundtable Summary: Towards a Better Aligned Private Equity World: Perspectives of Limited and General Partners,Harvard Business School / ILPA,2016,Roundtable summary,Venture Capital and Fundraising,LP/GP Fundraising History,Intermediate,9,8,recommended,https://www.hbs.edu/private-capital/Documents/ILPA-PCRI-Roundtable-2016.pdf,alignment; LPs; governance; private equity
venture-capital-angel-financing-and-crowdfunding-of-entrepre,"Venture capital, angel financing, and crowdfunding of entrepreneurial ventures: a literature review","Johannes Wallmeroth, Peter Wirtz, Alexander Peter Groh",2018,Literature review,Venture Capital and Fundraising,Angel Investing and Accelerators,Advanced,9,8,recommended,https://ideas.repec.org/a/now/fntent/0300000066.html,angel investing; crowdfunding; literature review; finance
corporate-venture-capital-as-a-real-option-in-the-markets-fo,Corporate Venture Capital as a Real Option in the Markets for Technology,M. Ceccagnoli et al. / NBER,2015,Academic paper,Venture Capital and Fundraising,Corporate VC,Advanced,9,8,recommended,https://www.nber.org/system/files/working_papers/w21424/w21424.pdf,CVC; real options; technology; strategy
have-secondaries-reached-a-tipping-point,Have Secondaries Reached a Tipping Point?,Bain & Company,2024,Report / article,Venture Capital and Fundraising,Secondary Markets and Continuation Funds,Intermediate,9,8,recommended,https://www.bain.com/insights/have-secondaries-reached-a-tipping-point-global-private-equity-report-2024/,secondaries; liquidity; Bain; private markets
secondary-market-2024-recap-outlook-for-2025,Secondary Market: 2024 Recap & Outlook for 2025,Coller Capital,2024,Industry report / interview,Venture Capital and Fundraising,Secondary Markets and Continuation Funds,Intermediate,9,8,recommended,https://www.collercapital.com/2024-market-recap-2025-outlook/,continuation funds; secondaries; Coller; GP-led
venture-capital-in-the-valley-past-present-future,"Venture Capital in the Valley: Past, Present & Future",Computer History Museum / Something Ventured,2011,Panel discussion,Venture Capital and Fundraising,Hidden Gems and Lesser-Known Historical Material,Beginner,9,8,recommended,https://www.youtube.com/watch?v=l_MW7PbuwlE,panel; Valley; history; VC
founder-mode,Founder Mode,Paul Graham,2024,Essay,Founder Mental Models,Leadership,Intermediate,9,8,recommended,https://www.paulgraham.com/foundermode.html,founder mode; management; scaling; culture
machines-of-loving-grace,Machines of Loving Grace,Dario Amodei,2024,Essay,AI in Practice,AI optimism,Intermediate,9,8,recommended,https://darioamodei.com/machines-of-loving-grace,ai-optimism; biology; progress; anthropic
alphago,AlphaGo,Greg Kohs (dir.) / DeepMind,2017,Documentary,Documentary and Long-Form Media,AI milestones,Beginner,9,8,recommended,,alphago; deepmind; go; documentary
why-software-is-eating-the-world,Why Software Is Eating the World,Marc Andreessen,2011,Essay,Startup History,Tech theses,Beginner,9,8,recommended,https://a16z.com/2011/08/20/why-software-is-eating-the-world/,software; disruption; a16z; thesis
only-the-paranoid-survive,Only the Paranoid Survive,Andy Grove,1996,Book,Startup History,Strategy under change,Intermediate,9,8,recommended,,strategy; inflection-point; intel; change
no-silver-bullet-essence-and-accident-in-software-engineerin,No Silver Bullet — Essence and Accident in Software Engineering,Fred Brooks,1986,Essay,Engineering and Systems,Software essence,Intermediate,9,8,recommended,,software-engineering; complexity; productivity; classic
reflections-on-trusting-trust,Reflections on Trusting Trust,Ken Thompson,1984,Lecture / essay,Engineering and Systems,Security,Advanced,10,7,recommended,,security; trust; supply-chain; turing-lecture
site-reliability-engineering-the-sre-book,Site Reliability Engineering (The SRE Book),"Google (Beyer, Jones, Petoff, Murphy, eds.)",2016,Book,Engineering and Systems,Operations,Advanced,9,8,recommended,https://sre.google/sre-book/table-of-contents/,sre; reliability; slo; operations
bad-blood-secrets-and-lies-in-a-silicon-valley-startup,Bad Blood: Secrets and Lies in a Silicon Valley Startup,John Carreyrou,2018,Book,Internet and Big Tech History,Fraud & cautionary tales,Beginner,9,8,recommended,,theranos; fraud; governance; cautionary
thinking-fast-and-slow,"Thinking, Fast and Slow",Daniel Kahneman,2011,Book,Founder Mental Models,Decision-making,Intermediate,9,8,recommended,,behavioral-econ; biases; decision-making; psychology
cramming-more-components-onto-integrated-circuits,Cramming More Components onto Integrated Circuits,Gordon Moore,1965,Paper,Hardware and Compute,Foundational,Intermediate,10,7,recommended,,moores-law; semiconductors; scaling; classic
how-the-world-really-works,How the World Really Works,Vaclav Smil,2022,Book,"Climate, Energy, and Deep Tech",Energy realism,Intermediate,9,8,recommended,,energy; materials; climate; realism
the-adolescence-of-technology,The Adolescence of Technology,Dario Amodei,2026,Essay,AI in Practice,AI risk & governance,Intermediate,9,8,recommended,https://darioamodei.com/essay/the-adolescence-of-technology,ai-safety; governance; anthropic; 2026
out-of-the-tar-pit,Out of the Tar Pit,"Ben Moseley, Peter Marks",2006,Paper,Engineering and Systems,Software Complexity,Advanced,8,8,reviewed,https://curtclifton.net/papers/MoseleyMarks06a.pdf,complexity; software-design; state; foundational-paper
founders-at-work,Founders at Work,Jessica Livingston,2007,Book,Startup History,First-hand Accounts,Beginner,8,8,recommended,,startups; founders; interviews; history
poor-charlies-almanack,Poor Charlie's Almanack,Charlie Munger (ed. Peter Kaufman),2005,Book,Founder Mental Models,Decision-Making,Intermediate,8,8,recommended,,mental-models; decision-making; investing; wisdom
soul-of-a-new-machine,The Soul of a New Machine,Tracy Kidder,1981,Book,Internet and Big Tech History,Engineering Culture,Beginner,9,7,recommended,,engineering-culture; hardware; teams; narrative
general-magic-documentary,General Magic,"Sarah Kerruish, Matt Maude",2018,Documentary,Documentary and Long-Form Media,Startup Stories,Beginner,8,7,core,https://www.generalmagicthemovie.com/,documentary; startups; failure; smartphone-history
how-to-get-startup-ideas,How to Get Startup Ideas,Paul Graham,2024,Video reading / commentary,Founder Mental Models,Startup ideas,Beginner,8,8,reviewed,https://www.youtube.com/watch?v=FlCWg-KkUN4,startup ideas; Paul Graham; founder discovery; problem selection
the-playbook-lessons-from-200-company-stories,The Playbook: Lessons from 200+ Company Stories,Acquired,2022,Podcast episode,Documentary and Long-Form Media,Podcast / company history,Intermediate,8,8,reviewed,https://www.acquired.fm/episodes/the-playbook-lessons-from-200-company-stories?96ed0d79_page=20,acquired; company history; strategy; podcast
rice-simple-prioritization-for-product-managers,RICE: Simple prioritization for product managers,Intercom,2018,Essay / framework,Product and Design,Prioritization,Beginner,8,8,reviewed,https://www.intercom.com/blog/rice-simple-prioritization-for-product-managers/,prioritization; product; framework; rice
clean-code,Clean Code,Robert C. Martin,2008,Book,Engineering and Systems,Code quality,Intermediate,8,8,reviewed,https://www.pearson.com/en-us/subject-catalog/p/clean-code-a-handbook-of-agile-software-craftsmanship/P200000009044/9780136083252,clean code; craft; engineering; book
scaling-up-excellence,Scaling Up Excellence,"Robert I. Sutton, Huggy Rao",2014,Book,Startup History,Scaling,Intermediate,8,8,reviewed,https://www.penguinrandomhouse.com/books/222302/scaling-up-excellence-by-robert-i-sutton-and-huggy-rao/,scaling; operations; growth; book
the-startup-way,The Startup Way,Eric Ries,2017,Book,Startup History,Enterprise innovation,Intermediate,8,8,reviewed,https://www.penguinrandomhouse.com/books/250646/the-startup-way-by-eric-ries/,innovation; enterprise; lean; book
cold-start-problem-andrew-chen,The Cold Start Problem: How to Start and Scale Network Effects,Andrew Chen,,Talk,Startup History,Network effects & growth,Intermediate,8,8,recommended,https://youtu.be/TSnYO34b3TA,network-effects; growth; startups; go-to-market; andrew-chen
how-y-combinator-started-the-origin-story-and-early-days,How Y Combinator Started - The Origin Story and Early Days,Paul Graham / YC commentary,2012,Video essay / commentary,Venture Capital and Fundraising,Angel Investing and Accelerators,Beginner,8,8,reviewed,https://www.youtube.com/watch?v=lhA42gSdjNQ,YC; origin story; accelerators; Paul Graham
lp-and-gp-led-secondaries-navigating-different-fund-styles-a,LP and GP led secondaries: Navigating different fund styles and continuation funds,Industry video,2024,Video,Venture Capital and Fundraising,Secondary Markets and Continuation Funds,Intermediate,8,8,reviewed,https://www.youtube.com/watch?v=2CdilCvKc0c,secondaries; continuation fund; LP-led; GP-led
the-myths-of-venture-capital,The Myths of Venture Capital,INET Economics / Julia Ott,2023,Interview video,Venture Capital and Fundraising,VC Critiques and Controversies,Intermediate,8,8,reviewed,https://www.ineteconomics.org/perspectives/videos/the-myths-of-venture-capital,critique; myths; INET; VC history
venture-capital-and-the-making-of-asset-driven-inequalities,venture capital and the making of asset-driven inequalities,Finance and Society / academic article,2025,Academic article,Venture Capital and Fundraising,VC Critiques and Controversies,Advanced,9,7,reviewed,https://www.cambridge.org/core/journals/finance-and-society/article/rapacious-ambivalence-of-vc-investment-venture-capital-value-capture-and-the-valorization-of-crisis/7A7C156AB0959AF85F2656FF2C635211,inequality; distribution; critique; VC
how-to-raise-a-venture-capital-fund,How to Raise a Venture Capital Fund,Winter Mead / Coolwater Capital,2021,Book and interviews,Venture Capital and Fundraising,LP/GP Fundraising History,Intermediate,8,8,reviewed,https://howtosetupaventurecapitalfund.com/,fundraising; LPs; emerging managers; VC fund
1-000-true-fans,"1,000 True Fans",Kevin Kelly,2008,Essay,Founder Mental Models,Creator economy,Beginner,8,8,recommended,https://kk.org/thetechnium/1000-true-fans/,creator-economy; niche; distribution; monetization
a-philosophy-of-software-design,A Philosophy of Software Design,John Ousterhout,2018,Book,Engineering and Systems,Design,Intermediate,8,8,reviewed,,software-design; complexity; abstraction; craft
the-everything-store-jeff-bezos-and-the-age-of-amazon,The Everything Store: Jeff Bezos and the Age of Amazon,Brad Stone,2013,Book,Internet and Big Tech History,Company history,Beginner,8,8,recommended,,amazon; bezos; company-history; strategy
the-dream-machine,The Dream Machine,M. Mitchell Waldrop,2001,Book,Internet and Big Tech History,Computing history,Intermediate,9,7,recommended,,licklider; arpa; computing-history; internet
amazon-s-antitrust-paradox,Amazon's Antitrust Paradox,Lina Khan,2017,Law journal article,Internet and Big Tech History,Antitrust & regulation,Advanced,9,7,recommended,https://www.yalelawjournal.org/note/amazons-antitrust-paradox,antitrust; amazon; regulation; policy
competing-against-luck-jobs-to-be-done,Competing Against Luck (Jobs to Be Done),Clayton Christensen et al.,2016,Book,Product and Design,Jobs to be Done,Intermediate,8,8,reviewed,,jtbd; product; innovation; demand
ethereum-whitepaper,Ethereum Whitepaper,Vitalik Buterin,2014,Whitepaper,Crypto and Web3,Smart contracts,Advanced,9,7,reviewed,https://ethereum.org/en/whitepaper/,ethereum; smart-contracts; web3; whitepaper
acquired-tsmc,Acquired: TSMC,Acquired (Ben Gilbert & David Rosenthal),2021,Podcast episode,Hardware and Compute,Company deep-dive,Intermediate,8,8,recommended,,tsmc; foundry; acquired; strategy
acquired-nvidia,Acquired: NVIDIA,Acquired (Ben Gilbert & David Rosenthal),2022,Podcast episode,Hardware and Compute,Company deep-dive,Intermediate,8,8,recommended,,nvidia; gpu; cuda; ai-infrastructure
the-idea-factory-bell-labs-and-the-great-age-of-american-inn,The Idea Factory: Bell Labs and the Great Age of American Innovation,Jon Gertner,2012,Book,Hardware and Compute,Innovation history,Intermediate,9,7,recommended,,bell-labs; r-and-d; innovation; transistor
the-prize-the-epic-quest-for-oil-money-power,"The Prize: The Epic Quest for Oil, Money & Power",Daniel Yergin,1990,Book,"Climate, Energy, and Deep Tech",Energy history,Advanced,9,7,reviewed,,energy; oil; geopolitics; history
the-gitlab-handbook-all-remote,The GitLab Handbook (All-Remote),GitLab,2020,Public handbook,Future of Work and Labor,Remote operations,Beginner,8,8,reviewed,https://handbook.gitlab.com/handbook/company/culture/all-remote/,remote-work; handbook; async; operations
recoding-america,Recoding America,Jennifer Pahlka,2023,Book,"Defense, Gov, and Public Tech",Govtech,Intermediate,8,8,recommended,,govtech; state-capacity; delivery; policy
the-state-of-ai-report-2025,The State of AI Report 2025,Nathan Benaich / Air Street Capital,2025,Report,AI in Practice,State of the field,Intermediate,8,8,recommended,https://www.stateof.ai/,state-of-ai; market; compute; report
cathedral-and-the-bazaar,The Cathedral and the Bazaar,Eric S. Raymond,1999,Essay,Engineering and Systems,Open Source,Beginner,8,7,reviewed,http://www.catb.org/~esr/writings/cathedral-bazaar/,open-source; software-culture; linux; essay
naval-how-to-get-rich,How to Get Rich (without getting lucky),Naval Ravikant,2019,Podcast Series,Founder Mental Models,Leverage & Wealth,Beginner,7,8,recommended,https://nav.al/rich,leverage; wealth; mental-models; podcast
dieter-rams-ten-principles,Ten Principles for Good Design,Dieter Rams,,Reference,Product and Design,Design Philosophy,Beginner,8,7,reviewed,https://www.vitsoe.com/us/about/good-design,design; principles; minimalism; product-design
hackers-heroes-levy,Hackers: Heroes of the Computer Revolution,Steven Levy,1984,Book,Internet and Big Tech History,Computing Culture,Beginner,8,7,reviewed,,hacker-culture; computing-history; mit; personal-computing
the-innovators-isaacson,The Innovators,Walter Isaacson,2014,Book,Internet and Big Tech History,Computing History,Beginner,8,7,reviewed,https://www.penguinrandomhouse.com/books/617365/los-innovadores--the-innovators-by-walter-isaacson/,computing-history; innovation; collaboration; narrative
how-will-you-measure-your-life,How Will You Measure Your Life?,"Clayton M. Christensen, James Allworth, Karen Dillon",2012,Book,Founder Mental Models,Life and leadership,Beginner,8,7,reviewed,https://www.harpercollins.com/products/how-will-you-measure-your-life-clayton-m-christensenjames-allworthkaren-dillon,leadership; culture; christensen; book
what-you-do-is-who-you-are,What You Do Is Who You Are,Ben Horowitz,2019,Book,Founder Mental Models,Enterprise transformation,Intermediate,8,7,reviewed,https://www.harpercollins.com/products/what-you-do-is-who-you-are-ben-horowitz,culture; leadership; organization; book
cs221-ai-history,AI History (Stanford CS221: Artificial Intelligence),Stanford CS221 / Stanford Online,2021,Lecture (Video),AI Foundations,History of AI,Intermediate,9,6,reviewed,https://www.youtube.com/watch?v=z8fEXuH0mu0,ai-history; stanford; cs221; foundations
ai-engineer-conference,AI Engineer (Conferences & Talk Library),AI Engineer,,Conference / Video Hub,AI in Practice,Community & talks,Intermediate,7,8,recommended,https://www.ai.engineer,ai-engineering; llms; agents; conference; applied-ai
startup-com-documentary,Startup.com,"Chris Hegedus, Jehane Noujaim (dir.)",2001,Documentary,Documentary and Long-Form Media,Startup Stories,Beginner,8,7,recommended,,documentary; startups; dot-com; failure; co-founders
silicon-cowboys-documentary,Silicon Cowboys,Jason Cohen (dir.),2016,Documentary,Documentary and Long-Form Media,Startup Stories,Beginner,8,7,recommended,,documentary; startups; compaq; pc-history; competition
situational-awareness-the-decade-ahead,Situational Awareness: The Decade Ahead,Leopold Aschenbrenner,2024,Essay series,AI in Practice,AGI forecasting,Intermediate,7,8,recommended,https://situational-awareness.ai/,agi; scaling; timelines; national-security
superintelligence-paths-dangers-strategies,"Superintelligence: Paths, Dangers, Strategies",Nick Bostrom,2014,Book,AI in Practice,AI risk,Advanced,8,7,recommended,,ai-safety; x-risk; alignment; philosophy
on-the-dangers-of-stochastic-parrots,On the Dangers of Stochastic Parrots,"Bender, Gebru, McMillan-Major, Shmitchell",2021,Paper,AI Foundations,AI ethics,Advanced,8,7,reviewed,https://dl.acm.org/doi/10.1145/3442188.3445922,llms; ai-ethics; bias; critique
sparks-of-artificial-general-intelligence-early-experiments,Sparks of Artificial General Intelligence: Early experiments with GPT-4,Bubeck et al. (Microsoft Research),2023,Paper,AI Foundations,Capability evaluation,Advanced,8,7,reviewed,https://arxiv.org/abs/2303.12712,gpt-4; agi; evaluation; emergence
the-coming-wave,The Coming Wave,Mustafa Suleyman,2023,Book,AI in Practice,AI and society,Intermediate,8,7,reviewed,,ai-governance; biotech; containment; policy
it-s-time-to-build,It's Time to Build,Marc Andreessen,2020,Essay,Founder Mental Models,Builder culture,Beginner,8,7,recommended,https://a16z.com/its-time-to-build/,builder-culture; progress; institutions; agency
the-almanack-of-naval-ravikant,The Almanack of Naval Ravikant,Eric Jorgenson,2020,Book,Founder Mental Models,Wealth & judgment,Beginner,7,8,recommended,https://www.navalmanack.com/,naval; leverage; wealth; philosophy
obviously-awesome,Obviously Awesome,April Dunford,2019,Book,Product and Design,Positioning,Beginner,7,8,reviewed,,positioning; gtm; category; marketing
the-rise-of-worse-is-better,The Rise of Worse Is Better,Richard P. Gabriel,1991,Essay,Engineering and Systems,Design philosophy,Intermediate,8,7,reviewed,https://www.dreamsongs.com/RiseOfWorseIsBetter.html,design; simplicity; tradeoffs; philosophy
the-twelve-factor-app,The Twelve-Factor App,Adam Wiggins / Heroku,2011,Reference,Engineering and Systems,Cloud-native,Intermediate,8,7,reviewed,https://12factor.net/,cloud-native; devops; saas; architecture
the-age-of-surveillance-capitalism,The Age of Surveillance Capitalism,Shoshana Zuboff,2019,Book,Internet and Big Tech History,Tech critique,Advanced,8,7,reviewed,,surveillance; privacy; ad-tech; critique
weapons-of-math-destruction,Weapons of Math Destruction,Cathy O'Neil,2016,Book,AI in Practice,Algorithmic harm,Beginner,8,7,reviewed,,algorithmic-bias; fairness; ml; accountability
the-attention-merchants,The Attention Merchants,Tim Wu,2016,Book,Internet and Big Tech History,Attention economy,Intermediate,8,7,reviewed,,attention; media; advertising; history
the-beginning-of-infinity,The Beginning of Infinity,David Deutsch,2011,Book,Founder Mental Models,Epistemology & progress,Advanced,8,7,reviewed,,progress; epistemology; optimism; philosophy
the-scalability-trilemma,The Scalability Trilemma,Vitalik Buterin,2021,Essay / concept,Crypto and Web3,Scaling vs decentralization,Advanced,8,7,reviewed,,scalability; decentralization; rollups; trilemma
stripe-climate-advance-market-commitments-frontier,Stripe Climate & Advance Market Commitments (Frontier),Stripe / Frontier,2020,Initiative / essay,"Climate, Energy, and Deep Tech",Carbon removal,Intermediate,8,7,reviewed,https://stripe.com/climate,carbon-removal; amc; frontier; climate-tech
ai-superpowers-china-silicon-valley-and-the-new-world-order,"AI Superpowers: China, Silicon Valley, and the New World Order",Kai-Fu Lee,2018,Book,Global Tech and Non-US Ecosystems,China & US AI,Beginner,8,7,recommended,,china; ai; geopolitics; ecosystems
state-of-european-tech,State of European Tech,Atomico,2024,Annual report,Global Tech and Non-US Ecosystems,Europe,Beginner,8,7,reviewed,https://stateofeuropeantech.com/,europe; venture; ecosystem; data
unit-x-how-the-pentagon-and-silicon-valley-are-transforming,Unit X: How the Pentagon and Silicon Valley Are Transforming the Future of War,Raj M. Shah & Christopher Kirchhoff,2024,Book,"Defense, Gov, and Public Tech",Defense innovation,Intermediate,8,7,recommended,,defense-tech; pentagon; procurement; diu
the-kill-chain-defending-america-in-the-future-of-high-tech,The Kill Chain: Defending America in the Future of High-Tech Warfare,Christian Brose,2020,Book,"Defense, Gov, and Public Tech",Future of warfare,Intermediate,8,7,recommended,,defense; autonomy; software; strategy
the-gentle-singularity,The Gentle Singularity,Sam Altman,2025,Essay,AI in Practice,AI vision,Beginner,8,7,recommended,https://blog.samaltman.com/the-gentle-singularity,agi; optimism; openai; singularity
empire-of-ai,Empire of AI,Karen Hao,2025,Book,AI in Practice,Power & institutions,Beginner,8,7,recommended,,openai; power; labor; critique
nvidia-gtc-2026-keynote-the-age-of-physical-ai,NVIDIA GTC 2026 Keynote: The Age of Physical AI,Jensen Huang / NVIDIA,2026,Keynote,Hardware and Compute,Compute & robotics,Intermediate,8,7,recommended,https://www.nvidia.com/gtc/keynote/,nvidia; physical-ai; robotics; compute
the-genius-act,The GENIUS Act,U.S. Congress,2025,Legislation,Crypto and Web3,Regulation,Intermediate,8,7,reviewed,https://en.wikipedia.org/wiki/GENIUS_Act,stablecoins; regulation; crypto-policy; 2025
where-wizards-stay-up-late,Where Wizards Stay Up Late: The Origins of the Internet,"Katie Hafner, Matthew Lyon",1996,Book,Internet and Big Tech History,Internet Origins,Beginner,8,6,reviewed,,internet-history; arpanet; packet-switching; networking
steve-jobs-stanford-2005,Stanford Commencement Address (2005),Steve Jobs,2005,Talk,Founder Mental Models,Vision & Motivation,Beginner,8,6,reviewed,https://news.stanford.edu/2005/06/12/youve-got-find-love-jobs-says/,motivation; vision; career; classic-talk
design-sprint-masterclass,Design Sprint Masterclass,AJ&Smart,,Course,Product and Design,Design practice,Beginner,7,7,reviewed,https://go.ajsmart.com/masterclass,design sprint; facilitation; workshop; course
the-clean-coder,The Clean Coder,Robert C. Martin,2011,Book,Engineering and Systems,Team practices,Intermediate,7,7,reviewed,https://www.pearson.com/en-us/subject-catalog/p/clean-coder-the-a-code-of-conduct-for-professional-programmers/P200000009045/9780132542883,professionalism; engineering; book; craft
