id,title,creator,year,format,category,subcategory,difficulty,credibility,usefulness,status,source_link,tags
karpathy-zero-to-hero,Neural Networks: Zero to Hero,Andrej Karpathy,2023,Course (Video),AI Foundations,Hands-on Learning,Advanced,10,10,core,https://karpathy.ai/zero-to-hero.html,llms; hands-on; gpt; pytorch; course
designing-data-intensive-applications,Designing Data-Intensive Applications,Martin Kleppmann,2017,Book,Engineering and Systems,Distributed Systems,Advanced,10,10,core,https://dataintensive.net/,distributed-systems; databases; data-engineering; systems-design
software-is-changing-again,Software Is Changing (Again),Andrej Karpathy,2025,Talk,AI in Practice,AI software paradigm,Intermediate,10,10,core,https://www.youtube.com/watch?v=vDWaKVmqznQ,Software 3.0; LLMs; agents; Karpathy
artificial-intelligence-index-report-2024,Artificial Intelligence Index Report 2024,Stanford HAI / AI Index Steering Committee,2024,Report,AI in Practice,State of the field,Intermediate,10,10,core,https://hai.stanford.edu/ai-index/2024-ai-index-report,ai index; trend report; stanford; policy
cs224n-natural-language-processing-with-deep-learning,CS224N: Natural Language Processing with Deep Learning,Stanford University,2023,Course,AI Foundations,NLP and LLMs,Advanced,10,10,core,https://web.stanford.edu/class/cs224n/,nlp; llms; stanford; deep learning
10-usability-heuristics-for-user-interface-design,10 Usability Heuristics for User Interface Design,Jakob Nielsen / Nielsen Norman Group,1994,Essay / framework,Product and Design,Usability,Beginner,10,10,core,https://www.nngroup.com/articles/ten-usability-heuristics/,usability; heuristics; ux; framework
refactoring,Refactoring,Martin Fowler,1999,Book / reference,Engineering and Systems,Refactoring,Intermediate,10,10,core,https://martinfowler.com/refactoring/,refactoring; code quality; martin fowler; book
the-lean-startup,The Lean Startup,Eric Ries,2011,Book,Startup History,Lean startup,Beginner,10,10,core,https://www.penguinrandomhouse.com/books/210088/the-lean-startup-by-eric-ries/,lean startup; mvp; iteration; book
vc-an-american-history,VC: An American History,Tom Nicholas / Harvard University Press,2019,Book,Venture Capital and Fundraising,Core Historical Foundations,Intermediate,10,10,core,https://www.hup.harvard.edu/books/9780674988002,history; foundations; venture capital; America
the-money-of-invention-how-venture-capital-creates-new-wealt,The Money of Invention: How Venture Capital Creates New Wealth,Josh Lerner and Paul Gompers / Harvard Business School Press,2001,Book,Venture Capital and Fundraising,Core Historical Foundations,Beginner,10,10,core,https://www.hbs.edu/faculty/Pages/item.aspx?num=10434,VC; wealth creation; finance; classic
the-power-law-venture-capital-and-the-making-of-the-new-futu,The Power Law: Venture Capital and the Making of the New Future,Sebastian Mallaby / Penguin Press,2022,Book,Venture Capital and Fundraising,Silicon Valley and Modern VC Model,Intermediate,10,10,core,https://www.cfr.org/books/power-law,Power Law; Silicon Valley; firms; strategy
attention-is-all-you-need,Attention Is All You Need,Ashish Vaswani et al. (Google),2017,Paper,AI Foundations,Deep Learning Architectures,Advanced,10,9,core,https://arxiv.org/abs/1706.03762,transformers; attention; nlp; foundational-paper; llms
3blue1brown-neural-networks,Neural Networks (video series),Grant Sanderson (3Blue1Brown),2017,Video Series,AI Foundations,Visual Explainers,Beginner,9,10,core,https://www.3blue1brown.com/topics/neural-networks,neural-networks; explainer; visual-learning; gradient-descent
before-the-startup,Before the Startup,Paul Graham,2014,Recorded lecture,Founder Mental Models,Founding phase,Beginner,10,10,recommended,https://www.youtube.com/watch?v=ii1jcLg-eIQ,idea generation; YC; founder mindset; Paul Graham
continuous-discovery-habits,Continuous Discovery Habits,Teresa Torres,2021,Book,Product and Design,Continuous discovery,Intermediate,9,10,core,https://www.producttalk.org/continuous-discovery-habits/,discovery; customer research; product; book
working-effectively-with-legacy-code,Working Effectively with Legacy Code,Michael Feathers,2004,Book,Engineering and Systems,Legacy code,Advanced,10,10,recommended,https://www.oreilly.com/library/view/working-effectively-with/0131177052/,legacy code; testing; refactoring; book
the-pragmatic-programmer,The Pragmatic Programmer,"Andy Hunt, Dave Thomas",2019,Book,Engineering and Systems,General craft,Intermediate,10,9,core,https://www.oreilly.com/library/view/the-pragmatic-programmer/9780135956977/,software craft; engineering; pragmatic; book
the-innovator-s-dilemma,The Innovator's Dilemma,Clayton M. Christensen,1997,Book,Startup History,Disruption theory,Intermediate,10,9,core,https://store.hbr.org/product/the-innovator-s-dilemma-with-a-new-foreword-when-new-technologies-cause-great-firms-to-fail/10706,disruption; strategy; innovation; book
interview-with-don-valentine-2004-april-21,"Interview with Don Valentine, 2004 April 21",Stanford Silicon Genesis,2004,Oral history interview,Venture Capital and Fundraising,Major Firms and Legendary Investors,Intermediate,10,10,recommended,https://exhibits.stanford.edu/silicongenesis/catalog/nn642hx4425,Don Valentine; Sequoia; oral history; Stanford
oral-history-with-alan-patricof,Oral History with Alan Patricof,Computer History Museum / NVCA,2010,Oral history interview,Venture Capital and Fundraising,Origins of Venture Capital,Intermediate,10,10,recommended,https://archive.computerhistory.org/resources/access/text/2019/03/102781064-05-01-acc.pdf,angel investing; oral history; Patricof; early VC
the-bitter-lesson,The Bitter Lesson,Richard Sutton,2019,Essay,AI Foundations,Research Philosophy,Beginner,9,9,core,http://www.incompleteideas.net/IncIdeas/BitterLesson.html,scaling; research-philosophy; compute; must-read-essay
software-2-0,Software 2.0,Andrej Karpathy,2017,Essay,AI in Practice,AI Engineering Mindset,Intermediate,9,9,core,https://karpathy.medium.com/software-2-0-a64152b37c35,ai-engineering; mental-model; ml-systems; must-read-essay
hard-thing-about-hard-things,The Hard Thing About Hard Things,Ben Horowitz,2014,Book,Startup History,Operating a Company,Intermediate,9,9,core,https://www.harpercollins.com/products/the-hard-thing-about-hard-things-ben-horowitz,startups; leadership; management; operating
how-to-start-a-startup-cs183b,How to Start a Startup (Stanford CS183B),"Sam Altman, Y Combinator, et al.",2014,Lecture Series,Startup History,Startup Curriculum,Beginner,9,9,core,https://startupclass.samaltman.com/,startups; y-combinator; curriculum; lectures
do-things-that-dont-scale,Do Things That Don't Scale,Paul Graham,2013,Essay,Founder Mental Models,Early-stage Tactics,Beginner,9,9,core,https://paulgraham.com/ds.html,startups; growth; early-stage; must-read-essay
how-to-do-great-work,How to Do Great Work,Paul Graham,2023,Essay,Founder Mental Models,Career & Craft,Beginner,9,9,core,https://paulgraham.com/greatwork.html,career; ambition; curiosity; must-read-essay
hamming-you-and-your-research,You and Your Research,Richard Hamming,1986,Talk,Founder Mental Models,Doing Important Work,Intermediate,9,9,core,https://www.cs.virginia.edu/~robins/YouAndYourResearch.html,research; career; great-work; classic-talk
design-of-everyday-things,The Design of Everyday Things,Don Norman,1988,Book,Product and Design,Design Principles,Beginner,9,9,core,https://mitpress.mit.edu/9780262525671/the-design-of-everyday-things/,design; ux; usability; human-centered-design
pg-how-to-raise-money,How to Raise Money,Paul Graham,2013,Essay,Venture Capital and Fundraising,Fundraising Tactics,Intermediate,9,9,core,https://paulgraham.com/fr.html,fundraising; seed; venture-capital; must-read-essay
openai-devday-opening-keynote,OpenAI DevDay: Opening Keynote,Sam Altman and OpenAI,2023,Keynote,AI in Practice,AI product launch,Intermediate,10,9,recommended,https://www.youtube.com/watch?v=U9mJuUkhUzk,OpenAI; developer platform; AI products; keynote
tim-brown-from-design-to-design-thinking,Tim Brown - From Design to Design Thinking,Tim Brown,2009,Talk,Product and Design,Design thinking,Beginner,10,9,recommended,https://www.youtube.com/watch?v=sq8EFbYBtOA,design thinking; IDEO; human-centered design; innovation
the-three-ways-that-good-design-makes-you-happy,The three ways that good design makes you happy,Don Norman,2003,Talk,Product and Design,Usability,Beginner,10,9,recommended,https://www.youtube.com/watch?v=RlQEoJaLQRA,Don Norman; emotional design; UX; usability
steve-jobs-introduces-the-macintosh,Steve Jobs Introduces the Macintosh,Steve Jobs,1984,Historical keynote,Internet and Big Tech History,Personal computing,Beginner,10,9,recommended,https://www.youtube.com/watch?v=1tQ5XwvjPmA,Apple; product launch; Steve Jobs; demo
steve-jobs-the-lost-interview,Steve Jobs: The Lost Interview,"Steve Jobs, Robert X. Cringely",1995,Interview documentary,Internet and Big Tech History,Founder interview,Beginner,10,9,recommended,https://www.youtube.com/watch?v=9m68auPIPRk,Steve Jobs; interview; Apple; product thinking
cs231n-deep-learning-for-computer-vision,CS231n: Deep Learning for Computer Vision,Stanford University,2021,Course,AI Foundations,Computer vision,Advanced,10,9,recommended,https://cs231n.stanford.edu/2021/,computer vision; deep learning; stanford; practical
deep-residual-learning-for-image-recognition,Deep Residual Learning for Image Recognition,"He, Zhang, Ren, Sun",2015,Paper,AI Foundations,Deep vision architecture,Advanced,10,9,recommended,https://arxiv.org/abs/1512.03385,resnet; vision; deep learning; paper
gpt-4-technical-report,GPT-4 Technical Report,OpenAI,2023,Technical report,AI in Practice,Frontier model report,Advanced,10,9,recommended,https://cdn.openai.com/papers/gpt-4.pdf,openai; gpt-4; report; multimodal
training-compute-optimal-large-language-models,Training Compute-Optimal Large Language Models,Hoffmann et al. (DeepMind),2022,Paper,AI Foundations,Scaling laws,Advanced,10,9,recommended,https://arxiv.org/abs/2203.15556,scaling laws; compute; training; llm
computer-history-museum-oral-histories,Computer History Museum Oral Histories,Computer History Museum,,Archive,Internet and Big Tech History,Oral history archive,Intermediate,10,9,recommended,https://computerhistory.org/oral-histories/,oral history; computing; archive; chm
continuous-delivery,Continuous Delivery,Martin Fowler,2013,Essay / book summary,Engineering and Systems,Delivery systems,Intermediate,10,9,recommended,https://martinfowler.com/bliki/ContinuousDelivery.html,deployment; devops; release; continuous delivery
essays-by-paul-graham,Essays by Paul Graham,Paul Graham / Y Combinator,,Essays,Founder Mental Models,Founder essays,Intermediate,9,10,recommended,https://www.ycombinator.com/library/carousel/Essays%20by%20Paul%20Graham,paul graham; essays; yc; founders
yc-startup-library,YC Startup Library,Y Combinator,2023,Library,Startup History,Startup library,Beginner,9,10,recommended,https://www.ycombinator.com/library,yc; startup; founder advice; library
the-mom-test,The Mom Test,Rob Fitzpatrick,2013,Book,Startup History,Customer discovery,Beginner,8,10,core,https://www.momtestbook.com/,customer discovery; interviews; validation; book
how-do-venture-capitalists-make-decisions,How Do Venture Capitalists Make Decisions?,Paul Gompers et al. / NBER,2016,Working paper,Venture Capital and Fundraising,Startup Financing and Fundraising History,Advanced,10,9,recommended,https://www.nber.org/system/files/working_papers/w22587/w22587.pdf,decision-making; NBER; VC process; empirical
venture-capital-data-opportunities-and-challenges,Venture Capital Data: Opportunities and Challenges,Steven N. Kaplan and Josh Lerner / Harvard Business School,2016,Working paper,Venture Capital and Fundraising,LP/GP Fundraising History,Advanced,10,9,recommended,https://www.hbs.edu/ris/Publication%20Files/17-012_10de1f93-30e4-4a98-858c-4137556ec037.pdf,LPs; funds; data; performance
institutions-and-venture-capital,Institutions and venture capital,Josh Lerner / Oxford Academic,2013,Article,Venture Capital and Fundraising,Origins of Venture Capital,Advanced,10,9,recommended,https://academic.oup.com/icc/article/22/1/153/884044,policy; institutions; SBIC; history
silicon-valley,Silicon Valley,PBS American Experience,2013,Documentary,Venture Capital and Fundraising,Silicon Valley and the Modern VC Model,Beginner,10,9,recommended,https://www.pbs.org/wgbh/americanexperience/films/silicon/,documentary; Silicon Valley; PBS; history
bill-draper-the-rise-of-sand-hill-road-and-silicon-valley,Bill Draper: The Rise of Sand Hill Road and Silicon Valley,Stanford,2015,Recorded lecture,Venture Capital and Fundraising,Silicon Valley and the Modern VC Model,Intermediate,10,9,recommended,https://www.youtube.com/watch?v=KxDxRUYEMXg,Bill Draper; Sand Hill Road; VC; history
cisco-oral-history-panel-john-morgridge-and-don-valentine,Cisco oral history panel: John Morgridge and Don Valentine,Computer History Museum,2014,Oral history panel,Venture Capital and Fundraising,Major Firms and Legendary Investors,Advanced,10,9,recommended,https://archive.computerhistory.org/resources/access/text/2015/09/102739934-05-01-acc.pdf,Cisco; Don Valentine; board; history
the-economics-within-the-private-equity-partnership,The Economics within the Private Equity Partnership,"Victoria Ivashina, Josh Lerner et al. / Harvard Business School",2016,Working paper,Venture Capital and Fundraising,LP/GP Fundraising History,Advanced,10,9,recommended,https://www.hbs.edu/ris/Publication%20Files/16-119_4925d447-80c5-4764-ad17-912b2baa918d.pdf,LP; GP; carry; fees
venture-capital-booms-and-start-up-financing,Venture Capital Booms and Start-Up Financing,"William Janeway, Ramana Nanda, Matthew Rhodes-Kropf / Harvard Business School",2021,Working paper / review,Venture Capital and Fundraising,"Bubbles, Booms, and Crashes",Advanced,10,9,recommended,https://www.hbs.edu/ris/Publication%20Files/21-116_c8365ab5-7cad-4ba3-9e02-ddec0191413f.pdf,cycles; booms; financing; startup market
oral-history-with-charles-w-newhall-iii,Oral History with Charles W. Newhall III,Computer History Museum / NVCA,2010,Oral history interview,Venture Capital and Fundraising,Origins of Venture Capital,Intermediate,10,9,recommended,https://archive.computerhistory.org/resources/access/text/2021/05/102792196-05-01-acc.pdf,angel; VC history; Newhall; oral history
oral-history-with-henry-f-mccance,Oral History with Henry F. McCance,Computer History Museum / NVCA,2010,Oral history interview,Venture Capital and Fundraising,Origins of Venture Capital,Intermediate,10,9,recommended,https://archive.computerhistory.org/resources/access/text/2019/03/102781068-05-01-acc.pdf,McCance; angel capital; history; VC
from-the-archives-y-combinator-founders-paul-graham-and-jess,From the Archives: Y Combinator Founders Paul Graham and Jessica Livingston on Studio 1.0,Bloomberg Technology,2014,Interview / recorded conversation,Venture Capital and Fundraising,Angel Investing and Accelerators,Beginner,9,10,recommended,https://www.youtube.com/watch?v=SuoPiiUBcOk,YC; accelerators; Paul Graham; Jessica Livingston
the-determinants-of-corporate-venture-capital-success,The Determinants of Corporate Venture Capital Success,Paul Gompers / NBER,2000,Academic paper,Venture Capital and Fundraising,Corporate VC,Advanced,10,9,recommended,https://www.nber.org/system/files/working_papers/w6725/w6725.pdf,CVC; corporate venture; NBER; history
the-next-new-thing-venture-capital-stories,The Next New Thing: Venture Capital Stories,Computer History Museum,2019,Oral history collection,Venture Capital and Fundraising,Hidden Gems and Lesser-Known Historical Material,Intermediate,10,9,recommended,https://computerhistory.org/stories/the-next-new-thing/,oral history; CHM; stories; VC
startup-growth,Startup = Growth,Paul Graham,2012,Essay,Founder Mental Models,Growth philosophy,Beginner,10,9,recommended,https://www.paulgraham.com/growth.html,growth; compounding; startups; PG
the-2026-ai-index-report,The 2026 AI Index Report,Stanford HAI,2026,Report,AI in Practice,State of the field,Intermediate,10,9,recommended,https://hai.stanford.edu/ai-index/2026-ai-index-report,ai-index; trends; 2026; benchmarks
computing-machinery-and-intelligence,Computing Machinery and Intelligence,Alan Turing,1950,Essay,AI Foundations,Origins of AI,Intermediate,10,7,core,https://academic.oup.com/mind/article/LIX/236/433/986238,ai-history; turing-test; philosophy-of-mind; foundational-essay
deep-learning-nature-2015,Deep Learning (Nature review),"Yann LeCun, Yoshua Bengio, Geoffrey Hinton",2015,Paper,AI Foundations,Surveys & Reviews,Intermediate,10,8,recommended,https://www.nature.com/articles/nature14539,deep-learning; survey; backpropagation; foundational-paper
state-of-gpt,State of GPT,Andrej Karpathy,2023,Talk,AI in Practice,LLM Systems,Intermediate,9,9,recommended,https://www.youtube.com/watch?v=bZQun8Y4L2A,llms; rlhf; training-pipeline; talk; applied-ai
zero-to-one,Zero to One,Peter Thiel with Blake Masters,2014,Book,Startup History,Startup Strategy,Beginner,8,9,core,https://www.penguinrandomhouse.com/books/234730/zero-to-one-by-peter-thiel-with-blake-masters/,startups; strategy; monopoly; contrarian-thinking
inventing-on-principle,Inventing on Principle,Bret Victor,2012,Talk,Product and Design,Interaction Design,Beginner,9,8,core,https://vimeo.com/36579366,design; tools; interaction; creativity; classic-talk
mother-of-all-demos,The Mother of All Demos,Douglas Engelbart,1968,Video,Internet and Big Tech History,Computing History,Beginner,10,7,core,https://www.dougengelbart.org/content/view/209/,computing-history; hci; engelbart; augmentation
marty-cagan-on-the-current-golden-era-for-product-management,Marty Cagan on the Current 'Golden Era' for Product Management,Marty Cagan,2024,Interview,Product and Design,Product leadership,Intermediate,9,9,recommended,https://www.youtube.com/watch?v=lu0a-VRkKeY,product management; product strategy; AI era; outcomes
release-it-michael-nygard-trisha-gee-goto-2023,Release It! • Michael Nygard & Trisha Gee • GOTO 2023,"Michael Nygard, Trisha Gee",2023,Talk / interview,Engineering and Systems,Production systems,Advanced,9,9,recommended,https://www.youtube.com/watch?v=BIuBnLTMkfQ,reliability; production systems; resilience; SRE
shape-up,Shape Up,37signals / Basecamp,2019,Book,Product and Design,Product development process,Intermediate,9,9,recommended,https://basecamp.com/shapeup,shape up; product process; basecamp; book
patterns-of-enterprise-application-architecture,Patterns of Enterprise Application Architecture,Martin Fowler and collaborators,2002,Book / reference,Engineering and Systems,Architecture,Advanced,10,8,recommended,https://martinfowler.com/books/eaa.html,architecture; patterns; enterprise; book
crossing-the-chasm,Crossing the Chasm,Geoffrey A. Moore,2014,Book,Startup History,Market adoption,Intermediate,9,9,recommended,https://www.harpercollins.com/products/crossing-the-chasm-3rd-edition-geoffrey-a-moore,gtm; adoption; market entry; book
startup-school,Startup School,Y Combinator,2022,Course,Startup History,Startup curriculum,Beginner,9,9,recommended,https://www.ycombinator.com/blog/startup-school,yc; course; founders; startup
creative-capital-georges-doriot-and-the-birth-of-venture-cap,Creative Capital: Georges Doriot and the Birth of Venture Capital,Spencer E. Ante / Harvard Business Press,2008,Book,Venture Capital and Fundraising,Origins of Venture Capital,Intermediate,9,9,recommended,https://books.google.com/books/about/Creative_Capital.html?id=Pex8b-qNoL8C,Doriot; ARD; origin; biography
how-venture-capital-works,How Venture Capital Works,Harvard Business Review,1998,Article,Venture Capital and Fundraising,Startup Financing and Fundraising History,Beginner,9,9,recommended,https://hbr.org/1998/11/how-venture-capital-works,VC basics; HBR; funds; exits
financing-new-ideas,Financing New Ideas,Harvard Business School / Georges F. Doriot exhibit,2010,Historical exhibit / essay,Venture Capital and Fundraising,Origins of Venture Capital,Beginner,10,8,recommended,https://www.library.hbs.edu/hc/doriot/innovation-vc/financing-new-ideas/,ARD; Doriot; HBS; history
origins-of-high-tech-venture-investing-in-america,Origins of High-Tech Venture Investing in America,Tom Nicholas / Harvard Business School,2016,Working paper,Venture Capital and Fundraising,Origins of Venture Capital,Advanced,10,8,recommended,https://www.hbs.edu/ris/Publication%20Files/VC_Tech_4b7a1b2a-ef2a-4867-a41e-2ba84cb120f2.pdf,history; technology; capital; origins
sequoia-capital-part-1,Sequoia Capital (Part 1),Acquired,2019,Podcast episode / long-form audio,Venture Capital and Fundraising,Major Firms and Legendary Investors,Intermediate,9,9,recommended,https://www.acquired.fm/episodes/sequoia-capital-part-1,Sequoia; Acquired; firm history; VC
chris-douvos-limited-partners-and-funds-of-funds,Chris Douvos: Limited Partners and Funds of Funds,Stanford / Entrepreneurship Through the Lens of Venture Capital,2015,Recorded lecture,Venture Capital and Fundraising,LP/GP Fundraising History,Intermediate,9,9,recommended,https://www.youtube.com/watch?v=sFGX2iPxc9Y,LP; fund of funds; Stanford; fundraising
dalton-caldwell-incubators-accelerators-and-y-combinator,"Dalton Caldwell: Incubators, Accelerators, and Y Combinator",Stanford,2015,Recorded lecture,Venture Capital and Fundraising,Angel Investing and Accelerators,Intermediate,9,9,recommended,https://www.youtube.com/watch?v=evATPGQq3oc,YC; accelerator; incubator; Stanford
the-entrepreneurial-state,The Entrepreneurial State,Mariana Mazzucato,2013,Book,Venture Capital and Fundraising,VC Critiques and Controversies,Intermediate,9,9,recommended,https://marianamazzucato.com/books/the-entrepreneurial-state/,critique; state; innovation policy; VC
pioneers-of-venture-capital,Pioneers of Venture Capital,Computer History Museum,2002,Recorded panel,Venture Capital and Fundraising,Hidden Gems and Lesser-Known Historical Material,Intermediate,10,8,recommended,https://www.youtube.com/watch?v=ult7VFgxiKo,pioneers; VC history; panel; Silicon Valley
high-output-management,High Output Management,Andy Grove,1983,Book,Founder Mental Models,Management,Intermediate,9,9,recommended,,management; intel; leverage; operations
amazon-shareholder-letters,Amazon Shareholder Letters,Jeff Bezos,1997,Letters,Startup History,Operating philosophy,Beginner,9,9,recommended,https://www.aboutamazon.com/news/company-news/2020-letter-to-shareholders,amazon; bezos; operating; long-term
7-powers-the-foundations-of-business-strategy,7 Powers: The Foundations of Business Strategy,Hamilton Helmer,2016,Book,Startup History,Moats & strategy,Intermediate,9,9,recommended,,strategy; moats; competition; frameworks
aggregation-theory,Aggregation Theory,Ben Thompson (Stratechery),2015,Essay,Startup History,Platform strategy,Intermediate,9,9,recommended,https://stratechery.com/2015/aggregation-theory/,aggregation; platforms; stratechery; strategy
bitcoin-a-peer-to-peer-electronic-cash-system,Bitcoin: A Peer-to-Peer Electronic Cash System,Satoshi Nakamoto,2008,Whitepaper,Crypto and Web3,Origins,Intermediate,10,8,recommended,https://bitcoin.org/bitcoin.pdf,bitcoin; blockchain; cryptography; whitepaper
chip-war-the-fight-for-the-world-s-most-critical-technology,Chip War: The Fight for the World's Most Critical Technology,Chris Miller,2022,Book,Hardware and Compute,Geopolitics of semiconductors,Intermediate,9,9,recommended,,semiconductors; tsmc; geopolitics; supply-chain
ai-engineering-building-applications-with-foundation-models,AI Engineering: Building Applications with Foundation Models,Chip Huyen,2025,Book,AI in Practice,Building with AI,Intermediate,9,9,recommended,,ai-engineering; rag; agents; evaluation
alexnet-imagenet-2012,ImageNet Classification with Deep Convolutional Neural Networks (AlexNet),"Alex Krizhevsky, Ilya Sutskever, Geoffrey Hinton",2012,Paper,AI Foundations,Deep Learning Architectures,Advanced,10,7,recommended,https://papers.nips.cc/paper/2012/hash/c399862d3b9d6b76c8436e924a68c45b-Abstract.html,deep-learning; computer-vision; cnn; foundational-paper; imagenet
andrew-ng-machine-learning,Machine Learning (Stanford CS229 / Coursera),Andrew Ng,2011,Course,AI Foundations,Fundamentals,Intermediate,9,8,recommended,https://www.coursera.org/specializations/machine-learning-introduction,machine-learning; fundamentals; course; supervised-learning
mythical-man-month,The Mythical Man-Month,Fred Brooks,1975,Book,Engineering and Systems,Software Project Management,Beginner,9,8,recommended,,software-engineering; management; classic; team-building
concurrency-is-not-parallelism,Concurrency Is Not Parallelism,Rob Pike,2012,Talk,Engineering and Systems,Concurrency,Intermediate,9,8,recommended,https://go.dev/blog/waza-talk,concurrency; parallelism; go; talk; systems
time-clocks-ordering-lamport,"Time, Clocks, and the Ordering of Events in a Distributed System",Leslie Lamport,1978,Paper,Engineering and Systems,Distributed Systems,Advanced,10,7,recommended,https://lamport.azurewebsites.net/pubs/time-clocks.pdf,distributed-systems; logical-clocks; foundational-paper; theory
end-to-end-arguments,End-to-End Arguments in System Design,"J. Saltzer, D. Reed, D. Clark",1984,Paper,Engineering and Systems,System Design Principles,Advanced,10,7,reviewed,https://web.mit.edu/Saltzer/www/publications/endtoend/endtoend.pdf,system-design; internet-architecture; foundational-paper; principles
sicp,Structure and Interpretation of Computer Programs (SICP),"Harold Abelson, Gerald Jay Sussman, Julie Sussman",1985,Book,Engineering and Systems,Programming Foundations,Advanced,10,7,recommended,https://mitpress.mit.edu/9780262510875/structure-and-interpretation-of-computer-programs/,programming; abstraction; computer-science; classic-textbook
